➜  phylo1 git:(main) ✗ busco -i genomes/hummingbird_genome/ncbi_dataset/data/*/*genomic.fna -l sauropsida_odb12 -o busco_out/hummingbird -m genome --cpu 1 -f
2025-10-19 06:51:46 INFO:       ***** Start a BUSCO v6.0.0 analysis, current time: 10/19/2025 06:51:46 *****
2025-10-19 06:51:46 INFO:       Configuring BUSCO with local environment
2025-10-19 06:51:46 INFO:       Running genome mode
2025-10-19 06:51:46 INFO:       'Force' option selected; overwriting previous results directory
2025-10-19 06:51:46 INFO:       Downloading information on latest versions of BUSCO data...
2025-10-19 06:51:50 INFO:       Input file is /data/genomes/hummingbird_genome/ncbi_dataset/data/GCF_003957555.1/GCF_003957555.1_bCalAnn1_v1.p_genomic.fna
2025-10-19 06:51:50 INFO:       The local file or folder /data/busco_downloads/lineages/sauropsida_odb12 is the last available version.
2025-10-19 06:51:54 INFO:       Running BUSCO using lineage dataset sauropsida_odb12 (eukaryota, 2025-07-01)
2025-10-19 06:51:54 INFO:       Running 1 job(s) on bbtools, starting at 10/19/2025 06:51:54
2025-10-19 06:52:01 INFO:       [bbtools]       1 of 1 task(s) completed
2025-10-19 06:52:01 INFO:       Running 1 job(s) on miniprot_index, starting at 10/19/2025 06:52:01
2025-10-19 06:52:53 INFO:       [miniprot_index]        1 of 1 task(s) completed
2025-10-19 06:53:00 INFO:       Running 1 job(s) on miniprot_align, starting at 10/19/2025 06:53:00
2025-10-19 10:48:43 INFO:       [miniprot_align]        1 of 1 task(s) completed
2025-10-19 10:48:57 INFO:       ***** Run HMMER on gene sequences *****
2025-10-19 10:49:10 INFO:       Running 6109 job(s) on hmmsearch, starting at 10/19/2025 10:49:10
2025-10-19 10:50:30 INFO:       [hmmsearch]     611 of 6109 task(s) completed
2025-10-19 10:51:34 INFO:       [hmmsearch]     1222 of 6109 task(s) completed
2025-10-19 10:52:34 INFO:       [hmmsearch]     1833 of 6109 task(s) completed
2025-10-19 10:53:41 INFO:       [hmmsearch]     2444 of 6109 task(s) completed
2025-10-19 10:54:48 INFO:       [hmmsearch]     3055 of 6109 task(s) completed
2025-10-19 10:55:46 INFO:       [hmmsearch]     3666 of 6109 task(s) completed
2025-10-19 10:56:48 INFO:       [hmmsearch]     4277 of 6109 task(s) completed
2025-10-19 10:57:49 INFO:       [hmmsearch]     4888 of 6109 task(s) completed
2025-10-19 10:58:50 INFO:       [hmmsearch]     5499 of 6109 task(s) completed
2025-10-19 10:59:51 INFO:       [hmmsearch]     6109 of 6109 task(s) completed
2025-10-19 10:59:58 INFO:       245 candidate overlapping regions found
2025-10-19 10:59:58 INFO:       58548 exons in total
2025-10-19 11:00:19 WARNING:    542 of 6009 Complete matches (9.0%) contain internal stop codons in Miniprot gene predictions
2025-10-19 11:00:23 INFO:

    -------------------------------------------------------------------------------------------
    |Results from dataset sauropsida_odb12                                                     |
    -------------------------------------------------------------------------------------------
    |C:98.2%[S:97.9%,D:0.3%],F:0.3%,M:1.5%,n:6118,E:9.0%                                       |
    |6009    Complete BUSCOs (C)    (of which 542 contain internal stop codons)                |
    |5989    Complete and single-copy BUSCOs (S)                                               |
    |20    Complete and duplicated BUSCOs (D)                                                  |
    |18    Fragmented BUSCOs (F)                                                               |
    |91    Missing BUSCOs (M)                                                                  |
    |6118    Total BUSCO groups searched                                                       |
    -------------------------------------------------------------------------------------------
2025-10-19 11:00:23 INFO:       BUSCO analysis done with WARNING(s). Total running time: 14913 seconds

***** Summary of warnings: *****
2025-10-19 11:00:19 WARNING:busco.busco_tools.hmmer     542 of 6009 Complete matches (9.0%) contain internal stop codons in Miniprot gene predictions

2025-10-19 11:00:23 INFO:       Results written in busco_out/hummingbird
2025-10-19 11:00:23 INFO:       For assistance with interpreting the results, please consult the userguide: https://busco.ezlab.org/busco_userguide.html

2025-10-19 11:00:23 INFO:       Visit this page https://gitlab.com/ezlab/busco#how-to-cite-busco to see how to cite BUSCO
2025-10-19 11:00:26 INFO:       Thank you for using BUSCO! Anonymous usage data is gathered to improve the tool. You may opt out with --opt-out-run-stats.
➜  phylo1 git:(main) ✗ busco -i genomes/turtle_genome/ncbi_dataset/data/*/*genomic.fna -l sauropsida_odb12 -o busco_out/turtle -m genome --cpu 1 -f
2025-10-19 15:31:43 INFO:       ***** Start a BUSCO v6.0.0 analysis, current time: 10/19/2025 15:31:43 *****
2025-10-19 15:31:43 INFO:       Configuring BUSCO with local environment
2025-10-19 15:31:43 INFO:       Running genome mode
2025-10-19 15:31:43 INFO:       Downloading information on latest versions of BUSCO data...
2025-10-19 15:31:46 INFO:       Input file is /data/genomes/turtle_genome/ncbi_dataset/data/GCF_011386835.1/GCF_011386835.1_ASM1138683v2_genomic.fna
2025-10-19 15:31:46 INFO:       The local file or folder /data/busco_downloads/lineages/sauropsida_odb12 is the last available version.
2025-10-19 15:31:53 INFO:       Running BUSCO using lineage dataset sauropsida_odb12 (eukaryota, 2025-07-01)
2025-10-19 15:31:53 INFO:       Running 1 job(s) on bbtools, starting at 10/19/2025 15:31:53
2025-10-19 15:32:06 INFO:       [bbtools]       1 of 1 task(s) completed
2025-10-19 15:32:06 INFO:       Running 1 job(s) on miniprot_index, starting at 10/19/2025 15:32:06
2025-10-19 15:32:56 ERROR:      The following job failed with the error code -9:
miniprot -t 1 -d busco_out/turtle/run_sauropsida_odb12/miniprot_output/ref.mpi /data/genomes/turtle_genome/ncbi_dataset/data/GCF_011386835.1/GCF_011386835.1_ASM1138683v2_genomic.fna
2025-10-19 15:32:56 ERROR:      Error message: [M::mp_ntseq_read@7.436*0.97] read 2372089908 bases in 9850 contigs
[M::mp_idx_build@7.437*0.97] 18539888 blocks

2025-10-19 15:33:02 ERROR:      Job failed with error code -9
2025-10-19 15:33:02 ERROR:      BUSCO analysis failed!
2025-10-19 15:33:02 ERROR:      Check the logs, read the user guide (https://busco.ezlab.org/busco_userguide.html), and check the BUSCO issue board on https://gitlab.com/ezlab/busco/issues

2025-10-19 15:33:02 INFO:       Thank you for using BUSCO! Anonymous usage data is gathered to improve the tool. You may opt out with --opt-out-run-stats.
➜  phylo1 git:(main) ✗ busco -i genomes/chicken_genome/ncbi_dataset/data/GCF_000002315.5/GCF_000002315.5_GRCg6a_genomic.fna -l sauropsida_odb12 -o busco_out/chicken -m genome --cpu 2 -f
2025-10-19 15:53:46 INFO:       ***** Start a BUSCO v6.0.0 analysis, current time: 10/19/2025 15:53:46 *****
2025-10-19 15:53:46 INFO:       Configuring BUSCO with local environment
2025-10-19 15:53:46 INFO:       Running genome mode
2025-10-19 15:53:46 INFO:       Downloading information on latest versions of BUSCO data...
2025-10-19 15:53:49 INFO:       Input file is /data/genomes/chicken_genome/ncbi_dataset/data/GCF_000002315.5/GCF_000002315.5_GRCg6a_genomic.fna
2025-10-19 15:53:50 INFO:       The local file or folder /data/busco_downloads/lineages/sauropsida_odb12 is the last available version.
2025-10-19 15:53:53 INFO:       Running BUSCO using lineage dataset sauropsida_odb12 (eukaryota, 2025-07-01)
2025-10-19 15:53:53 INFO:       Running 1 job(s) on bbtools, starting at 10/19/2025 15:53:53
2025-10-19 15:54:01 INFO:       [bbtools]       1 of 1 task(s) completed
2025-10-19 15:54:01 INFO:       Running 1 job(s) on miniprot_index, starting at 10/19/2025 15:54:01
2025-10-19 15:54:40 INFO:       [miniprot_index]        1 of 1 task(s) completed
2025-10-19 15:54:47 INFO:       Running 1 job(s) on miniprot_align, starting at 10/19/2025 15:54:47
2025-10-19 17:58:29 INFO:       [miniprot_align]        1 of 1 task(s) completed
2025-10-19 17:58:43 INFO:       ***** Run HMMER on gene sequences *****
2025-10-19 17:58:56 INFO:       Running 6118 job(s) on hmmsearch, starting at 10/19/2025 17:58:56
2025-10-19 17:59:43 INFO:       [hmmsearch]     612 of 6118 task(s) completed
2025-10-19 18:00:18 INFO:       [hmmsearch]     1224 of 6118 task(s) completed
2025-10-19 18:00:52 INFO:       [hmmsearch]     1836 of 6118 task(s) completed
2025-10-19 18:01:28 INFO:       [hmmsearch]     2448 of 6118 task(s) completed
2025-10-19 18:02:05 INFO:       [hmmsearch]     3059 of 6118 task(s) completed
2025-10-19 18:02:39 INFO:       [hmmsearch]     3671 of 6118 task(s) completed
2025-10-19 18:03:10 INFO:       [hmmsearch]     4283 of 6118 task(s) completed
2025-10-19 18:03:43 INFO:       [hmmsearch]     4895 of 6118 task(s) completed
2025-10-19 18:04:19 INFO:       [hmmsearch]     5507 of 6118 task(s) completed
2025-10-19 18:05:00 INFO:       [hmmsearch]     6118 of 6118 task(s) completed
2025-10-19 18:05:07 INFO:       240 candidate overlapping regions found
2025-10-19 18:05:07 INFO:       59551 exons in total
2025-10-19 18:05:30 WARNING:    508 of 6094 Complete matches (8.3%) contain internal stop codons in Miniprot gene predictions
2025-10-19 18:05:34 INFO:

    -------------------------------------------------------------------------------------------
    |Results from dataset sauropsida_odb12                                                     |
    -------------------------------------------------------------------------------------------
    |C:99.6%[S:99.4%,D:0.2%],F:0.0%,M:0.3%,n:6118,E:8.3%                                       |
    |6094    Complete BUSCOs (C)    (of which 508 contain internal stop codons)                |
    |6083    Complete and single-copy BUSCOs (S)                                               |
    |11    Complete and duplicated BUSCOs (D)                                                  |
    |3    Fragmented BUSCOs (F)                                                                |
    |21    Missing BUSCOs (M)                                                                  |
    |6118    Total BUSCO groups searched                                                       |
    -------------------------------------------------------------------------------------------
2025-10-19 18:05:34 INFO:       BUSCO analysis done with WARNING(s). Total running time: 7905 seconds

***** Summary of warnings: *****
2025-10-19 18:05:30 WARNING:busco.busco_tools.hmmer     508 of 6094 Complete matches (8.3%) contain internal stop codons in Miniprot gene predictions

2025-10-19 18:05:34 INFO:       Results written in busco_out/chicken
2025-10-19 18:05:34 INFO:       For assistance with interpreting the results, please consult the userguide: https://busco.ezlab.org/busco_userguide.html

2025-10-19 18:05:34 INFO:       Visit this page https://gitlab.com/ezlab/busco#how-to-cite-busco to see how to cite BUSCO
2025-10-19 18:05:37 INFO:       Thank you for using BUSCO! Anonymous usage data is gathered to improve the tool. You may opt out with --opt-out-run-stats.